{
  "adapter": "zig",
  "entry": "",
  "failureOutput": "CASE root.keeps enabled\nFAIL src/root.zig:12\n",
  "files": {
    "build.zig": "const std = @import(\"std\");\n\npub fn build(b: *std.Build) void {\n    const target = b.standardTargetOptions(.{});\n    const optimize = b.standardOptimizeOption(.{});\n    const tests = b.addTest(.{ .root_source_file = b.path(\"src/root.zig\"), .target = target, .optimize = optimize });\n    const run_tests = b.addRunArtifact(tests);\n    const test_step = b.step(\"test\", \"Run unit tests\");\n    test_step.dependOn(&run_tests.step);\n}\n",
    "src/root.zig": "const std = @import(\"std\");\n\npub fn enabled(value: bool) bool {\n    return value == true;\n}\n\ntest \"keeps enabled\" {\n    if (!enabled(true)) {\n        std.debug.print(\"CASE root.keeps enabled\\n\", .{});\n        std.debug.print(\"FAIL src/root.zig:12\\n\", .{});\n    }\n    try std.testing.expect(enabled(true));\n}\n"
  },
  "schema": "kiln.coal-fixture.v1"
}
