{
  "adapter": "rust-cargo",
  "entry": ".",
  "failureOutput": "test tests::keeps_enabled ... FAILED\nthread 'tests::keeps_enabled' panicked at src/lib.rs:11:9\n",
  "files": {
    "Cargo.lock": "# This file is automatically @generated by Cargo.\n# It is not intended for manual editing.\nversion = 4\n\n[[package]]\nname = \"kiln-coal-fixture\"\nversion = \"0.1.0\"\n",
    "Cargo.toml": "[package]\nname = \"kiln-coal-fixture\"\nversion = \"0.1.0\"\nedition = \"2021\"\npublish = false\n",
    "src/lib.rs": "pub fn enabled(value: bool) -> bool {\n    value == true\n}\n\n#[cfg(test)]\nmod tests {\n    use super::*;\n\n    #[test]\n    fn keeps_enabled() {\n        assert_eq!(enabled(true), true);\n    }\n}\n"
  },
  "schema": "kiln.coal-fixture.v1"
}
